{
  "id": "esc_b402ee9e",
  "createdAt": "2026-08-15T04:12:24.543Z",
  "reason": "risky_action_needs_confirmation",
  "goalOrCapability": "open-subaccount v1",
  "currentStepDescription": "click button \"Confirm & Open Account\"",
  "detail": "irreversible step requires explicit allowRisky authorization",
  "screenshotPath": "/Users/srimanthgattamaneni/Desktop/legacy-agent-hands/evidence/replay-open-subaccount-1786767143961/escalation-1786767144516.png",
  "status": "resolved",
  "humanNotes": "Checked the review screen against the request ticket: member 10234, Savings, $100. Matches, so the authorization is expected. Approved by an ops reviewer.",
  "humanActions": [
    {
      "at": "2026-08-15T04:12:32.062Z",
      "description": "operator left the session on http://localhost:4000/members/10234/new-subaccount (\"Mock Bank Back Office - Review & Confirm\") — no navigation observed"
    }
  ],
  "resolvedAt": "2026-08-15T04:12:31.521Z"
}