{
  "id": "esc_c06e784d",
  "createdAt": "2026-08-15T03:54:56.034Z",
  "reason": "risky_action_needs_confirmation",
  "goalOrCapability": "open-subaccount v1",
  "currentStepDescription": "click button \"Confirm & Open Account\"",
  "detail": "irreversible step requires explicit allowRisky authorization",
  "screenshotPath": "/Users/srimanthgattamaneni/Desktop/legacy-agent-hands/evidence/replay-open-subaccount-1786766095429/escalation-1786766096005.png",
  "status": "resolved",
  "humanActions": [],
  "humanNotes": "Reviewed the review-and-confirm screen against the originating request: member 10234, Savings, $100 initial deposit — matches the ticket, so this authorization is expected. Approved by an ops reviewer.",
  "resolvedAt": "2026-08-15T03:55:02.002Z"
}