{
  "id": "esc_43edaa00",
  "createdAt": "2026-08-14T16:47:48.918Z",
  "reason": "risky_action_needs_confirmation",
  "goalOrCapability": "open-subaccount v1",
  "currentStepDescription": "click button \"Confirm & Open Account\"",
  "detail": "irreversible step requires explicit allowRisky authorization",
  "screenshotPath": "/Users/srimanthgattamaneni/Desktop/legacy-agent-hands/evidence/replay-open-subaccount-1786726068347/escalation-1786726068889.png",
  "status": "resolved",
  "humanActions": [],
  "humanNotes": "Reviewed the review-and-confirm screen against the originating request: member 10234 (Jordan Alvarez), Savings, $100 initial deposit — matches the ticket, so this authorization is expected and safe. Approved by an ops reviewer via the operator console.",
  "resolvedAt": "2026-08-14T16:48:04.495Z"
}